{
  "versao": "1.0",
  "origem": {
    "sistema": "escolajba",
    "escola_inep": "12011517",
    "escola_nome": "Escola Exemplo",
    "ano_letivo": 2027,
    "gerado_em": "2026-10-18T10:00:00-05:00"
  },
  "turnos": [
    {
      "codigo": "INTEGRAL",
      "nome": "Integral"
    }
  ],
  "horarios": [
    {
      "turno": "INTEGRAL",
      "dia": 0,
      "ordem": 0,
      "hora_inicio": "07:00",
      "hora_fim": "07:50"
    },
    {
      "turno": "INTEGRAL",
      "dia": 0,
      "ordem": 1,
      "hora_inicio": "07:50",
      "hora_fim": "08:40"
    },
    {
      "turno": "INTEGRAL",
      "dia": 0,
      "ordem": 2,
      "hora_inicio": "08:40",
      "hora_fim": "09:30"
    },
    {
      "turno": "INTEGRAL",
      "dia": 0,
      "ordem": 3,
      "hora_inicio": "09:50",
      "hora_fim": "10:40"
    },
    {
      "turno": "INTEGRAL",
      "dia": 0,
      "ordem": 4,
      "hora_inicio": "13:30",
      "hora_fim": "14:20"
    },
    {
      "turno": "INTEGRAL",
      "dia": 0,
      "ordem": 5,
      "hora_inicio": "14:20",
      "hora_fim": "15:10"
    },
    {
      "turno": "INTEGRAL",
      "dia": 0,
      "ordem": 6,
      "hora_inicio": "15:30",
      "hora_fim": "16:20"
    },
    {
      "turno": "INTEGRAL",
      "dia": 1,
      "ordem": 0,
      "hora_inicio": "07:00",
      "hora_fim": "07:50"
    },
    {
      "turno": "INTEGRAL",
      "dia": 1,
      "ordem": 1,
      "hora_inicio": "07:50",
      "hora_fim": "08:40"
    },
    {
      "turno": "INTEGRAL",
      "dia": 1,
      "ordem": 2,
      "hora_inicio": "08:40",
      "hora_fim": "09:30"
    },
    {
      "turno": "INTEGRAL",
      "dia": 1,
      "ordem": 3,
      "hora_inicio": "09:50",
      "hora_fim": "10:40"
    },
    {
      "turno": "INTEGRAL",
      "dia": 1,
      "ordem": 4,
      "hora_inicio": "13:30",
      "hora_fim": "14:20"
    },
    {
      "turno": "INTEGRAL",
      "dia": 1,
      "ordem": 5,
      "hora_inicio": "14:20",
      "hora_fim": "15:10"
    },
    {
      "turno": "INTEGRAL",
      "dia": 1,
      "ordem": 6,
      "hora_inicio": "15:30",
      "hora_fim": "16:20"
    },
    {
      "turno": "INTEGRAL",
      "dia": 2,
      "ordem": 0,
      "hora_inicio": "07:00",
      "hora_fim": "07:50"
    },
    {
      "turno": "INTEGRAL",
      "dia": 2,
      "ordem": 1,
      "hora_inicio": "07:50",
      "hora_fim": "08:40"
    },
    {
      "turno": "INTEGRAL",
      "dia": 2,
      "ordem": 2,
      "hora_inicio": "08:40",
      "hora_fim": "09:30"
    },
    {
      "turno": "INTEGRAL",
      "dia": 2,
      "ordem": 3,
      "hora_inicio": "09:50",
      "hora_fim": "10:40"
    },
    {
      "turno": "INTEGRAL",
      "dia": 2,
      "ordem": 4,
      "hora_inicio": "13:30",
      "hora_fim": "14:20"
    },
    {
      "turno": "INTEGRAL",
      "dia": 2,
      "ordem": 5,
      "hora_inicio": "14:20",
      "hora_fim": "15:10"
    },
    {
      "turno": "INTEGRAL",
      "dia": 2,
      "ordem": 6,
      "hora_inicio": "15:30",
      "hora_fim": "16:20"
    },
    {
      "turno": "INTEGRAL",
      "dia": 3,
      "ordem": 0,
      "hora_inicio": "07:00",
      "hora_fim": "07:50"
    },
    {
      "turno": "INTEGRAL",
      "dia": 3,
      "ordem": 1,
      "hora_inicio": "07:50",
      "hora_fim": "08:40"
    },
    {
      "turno": "INTEGRAL",
      "dia": 3,
      "ordem": 2,
      "hora_inicio": "08:40",
      "hora_fim": "09:30"
    },
    {
      "turno": "INTEGRAL",
      "dia": 3,
      "ordem": 3,
      "hora_inicio": "09:50",
      "hora_fim": "10:40"
    },
    {
      "turno": "INTEGRAL",
      "dia": 3,
      "ordem": 4,
      "hora_inicio": "13:30",
      "hora_fim": "14:20"
    },
    {
      "turno": "INTEGRAL",
      "dia": 3,
      "ordem": 5,
      "hora_inicio": "14:20",
      "hora_fim": "15:10"
    },
    {
      "turno": "INTEGRAL",
      "dia": 3,
      "ordem": 6,
      "hora_inicio": "15:30",
      "hora_fim": "16:20"
    },
    {
      "turno": "INTEGRAL",
      "dia": 4,
      "ordem": 0,
      "hora_inicio": "07:00",
      "hora_fim": "07:50"
    },
    {
      "turno": "INTEGRAL",
      "dia": 4,
      "ordem": 1,
      "hora_inicio": "07:50",
      "hora_fim": "08:40"
    },
    {
      "turno": "INTEGRAL",
      "dia": 4,
      "ordem": 2,
      "hora_inicio": "08:40",
      "hora_fim": "09:30"
    },
    {
      "turno": "INTEGRAL",
      "dia": 4,
      "ordem": 3,
      "hora_inicio": "09:50",
      "hora_fim": "10:40"
    },
    {
      "turno": "INTEGRAL",
      "dia": 4,
      "ordem": 4,
      "hora_inicio": "13:30",
      "hora_fim": "14:20"
    },
    {
      "turno": "INTEGRAL",
      "dia": 4,
      "ordem": 5,
      "hora_inicio": "14:20",
      "hora_fim": "15:10"
    },
    {
      "turno": "INTEGRAL",
      "dia": 4,
      "ordem": 6,
      "hora_inicio": "15:30",
      "hora_fim": "16:20"
    }
  ],
  "turmas": [
    {
      "codigo": "TUR-201",
      "nome": "6º ano A",
      "turno": "INTEGRAL"
    },
    {
      "codigo": "TUR-202",
      "nome": "6º ano B",
      "turno": "INTEGRAL"
    }
  ],
  "disciplinas": [
    {
      "codigo": "DIS-11",
      "nome": "Língua Portuguesa"
    },
    {
      "codigo": "DIS-12",
      "nome": "Matemática"
    },
    {
      "codigo": "DIS-13",
      "nome": "Ciências"
    },
    {
      "codigo": "DIS-14",
      "nome": "História"
    },
    {
      "codigo": "DIS-15",
      "nome": "Geografia"
    },
    {
      "codigo": "DIS-16",
      "nome": "Língua Inglesa"
    },
    {
      "codigo": "DIS-17",
      "nome": "Educação Física"
    },
    {
      "codigo": "DIS-18",
      "nome": "Arte"
    },
    {
      "codigo": "DIS-19",
      "nome": "Projeto de Vida"
    }
  ],
  "professores": [
    {
      "codigo": "SRV-101",
      "nome": "Ana Souza"
    },
    {
      "codigo": "SRV-102",
      "nome": "Bruno Lima"
    },
    {
      "codigo": "SRV-103",
      "nome": "Carla Dias"
    },
    {
      "codigo": "SRV-104",
      "nome": "Diego Rocha"
    },
    {
      "codigo": "SRV-105",
      "nome": "Elisa Melo"
    },
    {
      "codigo": "SRV-106",
      "nome": "Fábio Nunes"
    }
  ],
  "recursos": [
    {
      "codigo": "QUADRA",
      "nome": "Quadra poliesportiva",
      "capacidade": 1
    }
  ],
  "disponibilidades": [
    {
      "professor": "SRV-104",
      "turno": "INTEGRAL",
      "dia": 4,
      "ordem": 0,
      "status": "indisponivel"
    },
    {
      "professor": "SRV-104",
      "turno": "INTEGRAL",
      "dia": 4,
      "ordem": 1,
      "status": "indisponivel"
    },
    {
      "professor": "SRV-104",
      "turno": "INTEGRAL",
      "dia": 4,
      "ordem": 2,
      "status": "indisponivel"
    },
    {
      "professor": "SRV-104",
      "turno": "INTEGRAL",
      "dia": 4,
      "ordem": 3,
      "status": "indisponivel"
    },
    {
      "professor": "SRV-104",
      "turno": "INTEGRAL",
      "dia": 4,
      "ordem": 4,
      "status": "indisponivel"
    },
    {
      "professor": "SRV-104",
      "turno": "INTEGRAL",
      "dia": 4,
      "ordem": 5,
      "status": "indisponivel"
    },
    {
      "professor": "SRV-104",
      "turno": "INTEGRAL",
      "dia": 4,
      "ordem": 6,
      "status": "indisponivel"
    },
    {
      "professor": "SRV-102",
      "turno": "INTEGRAL",
      "dia": 0,
      "ordem": 0,
      "status": "evita"
    }
  ],
  "atribuicoes": [
    {
      "professor": "SRV-101",
      "disciplina": "DIS-11",
      "turma": "TUR-201",
      "carga_semanal": 6,
      "geminadas": 0,
      "recursos": []
    },
    {
      "professor": "SRV-102",
      "disciplina": "DIS-12",
      "turma": "TUR-201",
      "carga_semanal": 6,
      "geminadas": 0,
      "recursos": []
    },
    {
      "professor": "SRV-103",
      "disciplina": "DIS-13",
      "turma": "TUR-201",
      "carga_semanal": 4,
      "geminadas": 0,
      "recursos": []
    },
    {
      "professor": "SRV-104",
      "disciplina": "DIS-14",
      "turma": "TUR-201",
      "carga_semanal": 3,
      "geminadas": 0,
      "recursos": []
    },
    {
      "professor": "SRV-103",
      "disciplina": "DIS-15",
      "turma": "TUR-201",
      "carga_semanal": 3,
      "geminadas": 0,
      "recursos": []
    },
    {
      "professor": "SRV-105",
      "disciplina": "DIS-16",
      "turma": "TUR-201",
      "carga_semanal": 3,
      "geminadas": 0,
      "recursos": []
    },
    {
      "professor": "SRV-106",
      "disciplina": "DIS-17",
      "turma": "TUR-201",
      "carga_semanal": 3,
      "geminadas": 1,
      "recursos": [
        "QUADRA"
      ]
    },
    {
      "professor": "SRV-105",
      "disciplina": "DIS-18",
      "turma": "TUR-201",
      "carga_semanal": 3,
      "geminadas": 1,
      "recursos": []
    },
    {
      "professor": "SRV-104",
      "disciplina": "DIS-19",
      "turma": "TUR-201",
      "carga_semanal": 4,
      "geminadas": 0,
      "recursos": []
    },
    {
      "professor": "SRV-101",
      "disciplina": "DIS-11",
      "turma": "TUR-202",
      "carga_semanal": 6,
      "geminadas": 0,
      "recursos": []
    },
    {
      "professor": "SRV-102",
      "disciplina": "DIS-12",
      "turma": "TUR-202",
      "carga_semanal": 6,
      "geminadas": 0,
      "recursos": []
    },
    {
      "professor": "SRV-103",
      "disciplina": "DIS-13",
      "turma": "TUR-202",
      "carga_semanal": 4,
      "geminadas": 0,
      "recursos": []
    },
    {
      "professor": "SRV-104",
      "disciplina": "DIS-14",
      "turma": "TUR-202",
      "carga_semanal": 3,
      "geminadas": 0,
      "recursos": []
    },
    {
      "professor": "SRV-103",
      "disciplina": "DIS-15",
      "turma": "TUR-202",
      "carga_semanal": 3,
      "geminadas": 0,
      "recursos": []
    },
    {
      "professor": "SRV-105",
      "disciplina": "DIS-16",
      "turma": "TUR-202",
      "carga_semanal": 3,
      "geminadas": 0,
      "recursos": []
    },
    {
      "professor": "SRV-106",
      "disciplina": "DIS-17",
      "turma": "TUR-202",